{
    "__author": "Orcaramelo",
    "version": 3,
    "type": 2,
    "name": "orcaramelo_hatsune_miku",
    "img_sit": "orcaramelo_hatsune_miku",
    "pose_map": {
        "mpm_type": 0,
        "p1": true,
        "p2": true,
        "p3": true,
        "p4": true,
        "p5": true,
        "p6": true,
        "p7": true
    },
    "stay_on_start": true,
    "ex_props": {
        "desired-hair-prop": "twintails",
        "costume": "o31",
        "cosplay": true,
        "bare-shoulders": true
    },
    "select_info": {
        "display_name": "Hatsune Miku",
        "thumb": "orcaramelo_hatsune_miku",
        "group": "clothes",
        "select_dlg": [
            "The first sound of the future!",
            "Ready for the stage!",
            "Only missing a leek..."
        ]
    },
    "pose_arms": {
        "crossed": {
            "tag": "crossed",
            "layers": "5^10"
        },
        "left-down": {
            "tag": "down",
            "layers": "0"
        },
        "left-rest": {
            "tag": "rest",
            "layers": "10"
        },
        "right-down": {
            "tag": "down",
            "layers": "0"
        },
        "right-point": {
            "tag": "point",
            "layers": "0"
        },
        "right-restpoint": {
            "tag": "restpoint",
            "layers": "10"
        },
        "steepling": {
            "tag": "steepling",
            "layers": "10"
        },
        "def|left-def": {
            "tag": "def",
            "layers": "10"
        },
        "def|right-def": {
            "tag": "def",
            "layers": "5^10"
        }
    },
    "giftname": "hatsunemikucosplay"
}
