{
    "__author": "briaryoung",
    "version": 3,
    "type": 2,
    "name": "briaryoung_cross_strap_bikini_green",
    "img_sit": "briaryoung_cross_strap_bikini_green",
    "pose_map": {
        "mpm_type": 0,
        "default": true,
        "use_reg_for_l": true
    },
    "stay_on_start": true,
    "ex_props": {
        "compat-downtiedstrand": true
    },
    "select_info": {
        "display_name": "Cross Strap Bikini (Green)",
        "thumb": "briaryoung_cross_strap_bikini_green",
        "group": "clothes",
        "select_dlg": [
            "Are we going to the beach?"
        ]
    },
    "giftname": "crossstrapbikinigreen",
    "pose_arms": {}
}
