{
    "__author": "briaryoung",
    "version": 3,
    "type": 2,
    "name": "briaryoung_heart_cut_bikini_white",
    "img_sit": "briaryoung_heart_cut_bikini_white",
    "pose_map": {
        "mpm_type": 0,
        "default": true,
        "use_reg_for_l": true
    },
    "stay_on_start": true,
    "ex_props": {
        "compat-downtiedstrand": true,
        "bare-shoulders": true,
        "wet": true
    },
    "select_info": {
        "display_name": "Heart-Cut Bikini (White)",
        "thumb": "briaryoung_heart_cut_bikini_white",
        "group": "clothes",
        "select_dlg": [
            "I love this look!"
        ]
    },
    "giftname": "heartcutbikiniwhite",
    "pose_arms": {}
}
