{
    "__author": [
        "multimokia",
        "mocca_bun"
    ],
    "ex_props": {
        "bare-shoulders": true
    },
    "version": 3,
    "type": 2,
    "name": "mocca_bun_blackandwhitestripedpullover",
    "img_sit": "mocca_bun_blackandwhitestripedpullover",
    "pose_map": {
        "mpm_type": 0,
        "default": false,
        "use_reg_for_l": true,
        "p1": true,
        "p2": true,
        "p3": true,
        "p4": true,
        "p5": true,
        "p6": true,
        "p7": true
    },
    "stay_on_start": true,
    "select_info": {
        "display_name": "Pullover (Black and White Stripe)",
        "thumb": "mocca_bun_blackandwhitestripedpullover",
        "group": "clothes",
        "select_dlg": [
            "How do I look, [player]?",
            "Pretty cute, right?",
            "Great choice, [player]! This is so comfortable~"
        ]
    },
    "giftname": "blackandwhitestripedpullover",
    "pose_arms": {
        "crossed": {
            "tag": "crossed",
            "layers": "5"
        },
        "left-down": {
            "tag": "down",
            "layers": "0^5"
        },
        "left-rest": {
            "tag": "rest",
            "layers": "10"
        },
        "right-down": {
            "tag": "down",
            "layers": "0^5"
        },
        "right-point": {
            "tag": "point",
            "layers": "0"
        },
        "right-restpoint": {
            "tag": "restpoint",
            "layers": "10"
        },
        "steepling": {
            "tag": "steepling",
            "layers": "10"
        },
        "def|left-def": {
            "tag": "def",
            "layers": "10"
        },
        "def|right-def": {
            "tag": "def",
            "layers": "5"
        }
    }
}
