{
    "__author": "hatana",
    "version": 3,
    "type": 2,
    "name": "hatana_2b",
    "img_sit": "hatana_2b",
    "pose_map": {
        "mpm_type": 0,
        "default": false,
        "l_default": false,
        "p1": true,
        "p2": true,
        "p3": true,
        "p4": true,
        "p5": true,
        "p6": true,
        "p7": true
    },
    "stay_on_start": true,
    "ex_props": {
        "cosplay": true,
        "costume": "o31",
        "hide-ring": true
    },
    "select_info": {
        "display_name": "YoRHa No.2 Type B",
        "thumb": "hatana_2b",
        "group": "clothes"
    },
    "giftname": "2bcosplay",
    "pose_arms": {
        "crossed": {
            "tag": "crossed",
            "layers": "5^10"
        },
        "left-down": {
            "tag": "down",
            "layers": "0"
        },
        "left-rest": {
            "tag": "rest",
            "layers": "10"
        },
        "right-down": {
            "tag": "down",
            "layers": "0"
        },
        "right-point": {
            "tag": "point",
            "layers": "0"
        },
        "right-restpoint": {
            "tag": "restpoint",
            "layers": "10"
        },
        "steepling": {
            "tag": "steepling",
            "layers": "10"
        },
        "def|left-def": {
            "tag": "def",
            "layers": "10"
        },
        "def|right-def": {
            "tag": "def",
            "layers": "5^10"
        }
    }
}
