{
    "__author": "Finale",
    "version": 3,
    "type": 2,
    "name": "finale_shirt_resthere",
    "img_sit": "finale_shirt_resthere",
    "pose_map": {
        "mpm_type": 0,
        "default": false,
        "use_reg_for_l": true,
        "p1": true,
        "p2": true,
        "p3": true,
        "p4": true,
        "p5": true,
        "p6": true,
        "p7": true
    },
    "stay_on_start": true,
    "select_info": {
        "display_name": "Shirt (Rest Here)",
        "thumb": "finale_shirt_resthere",
        "group": "clothes",
        "select_dlg": [
            "Great choice, [player]! This is so comfortable~",
            "I can't wait until you actually can rest your head here~"
        ]
    },
    "giftname": "resthereshirt",
    "pose_arms": {
        "crossed": {
            "tag": "crossed",
            "layers": "5"
        },
        "left-down": {
            "tag": "down",
            "layers": "0"
        },
        "left-rest": {
            "tag": "rest",
            "layers": "10"
        },
        "right-down": {
            "tag": "down",
            "layers": "0"
        },
        "right-point": {
            "tag": "point",
            "layers": "0"
        },
        "right-restpoint": {
            "tag": "restpoint",
            "layers": "10"
        },
        "steepling": {
            "tag": "steepling",
            "layers": "10"
        },
        "def|left-def": {
            "tag": "def",
            "layers": "10"
        },
        "def|right-def": {
            "tag": "def",
            "layers": "5"
        }
    }
}
