{
    "__author": "Briar Young",
    "version": 3,
    "type": 2,
    "name": "briaryoung_dress_dark_blue_sparkle",
    "img_sit": "briaryoung_dress_dark_blue_sparkle",
    "pose_map": {
        "mpm_type": 0,
        "default": true,
        "use_reg_for_l": true
    },
    "stay_on_start": true,
    "ex_props": {
        "bikini": true,
        "bare-shoulders": true
    },
    "select_info": {
        "display_name": "Dress (Dark blue, sparkly)",
        "thumb": "briaryoung_dress_dark_blue_sparkle",
        "group": "clothes",
        "select_dlg": [
            "Glittery as the night sky~",
            "This is so pretty!"
        ]
    },
    "giftname": "dressdarkbluesparkle",
    "pose_arms": {}
}

